{
  "schema_version": "0.3",
  "isms_p_version": "2023.11",
  "source_url": "https://isms.kisa.or.kr/main/ispims/notice/?boardId=bbs_0000000000000014&cntId=21&mode=view",
  "source_document": "정보보호 및 개인정보보호 관리체계(ISMS-P) 인증기준 안내서 (KISA, 2023.11)",
  "last_verified": "2026-05-10",
  "description": "ISMS-P 인증기준 매핑 테이블. 공식 101개 중 56개 통제항목 커버 (Sprint 2-C 에서 27개 신규 추가). signals[] 는 isms-p-audit Skill 이 정적 분석 시 사용하는 검사 규칙. 모든 ID/명칭은 KISA 2023.11 안내서로 1차 출처 검증 완료. v0.3 부터 access_tier 필드를 통해 정적/외부도구/클라우드RO/런타임 4단계 검증을 지원. v0.4 부터 stack-specific 시그널은 references/stacks/ 의 별도 profile 로 분리 (controls.json 은 stack-agnostic 시그널만 보유). v0.4.5 부터 각 통제에 required_capabilities[] 메타 필드 추가 (시그널 변경 0, capabilities.json 의 capability+aspect 매핑). v0.5.0-B 부터 각 통제에 applicable_to[] 메타 필드 추가 — 레포 역할(frontend/backend/fullstack/infra/mobile/all)별 평가 가능성 분리 (시그널 변경 0).",
  "controls": [
    {
      "id": "1.1.5",
      "name": "정책 수립",
      "category": "관리체계 수립 및 운영",
      "auto_checkable": "partial",
      "applicable_to": ["all"],
      "signals": [
        { "type": "glob_exists", "access_tier": 0, "pattern": "**/{SECURITY.md,security-policy.md,SECURITY.markdown}", "description": "보안/취약점 신고 정책 문서 존재", "family": "security_policy_doc", "required": false },
        { "type": "glob_exists", "access_tier": 0, "pattern": "**/docs/security/**", "description": "보안 정책 문서 디렉터리 존재", "family": "security_policy_doc", "required": false },
        { "type": "manual_review", "access_tier": 0, "description": "정보보호·개인정보보호 정책서 및 시행문서의 경영진 승인·게시·검토 이력은 외부 증적 (정책 결재 문서, 게시판 캡처)", "family": "policy_governance_doc", "required": true }
      ],
      "required_capabilities": [
        { "id": "governance", "required_aspects": ["security_policy_doc_present"] }
      ],
      "evidence_hint": "정책서 결재 문서 / 정책 게시 화면 / 정기 검토(연 1회 이상) 회의록",
      "cross_mappings": {
              "iso_27001_2022": {
                      "ids": [
                              "A.5.1"
                      ],
                      "status": "verified",
                      "note": "정보보안 정책"
              },
              "nist_csf_2_0": {
                      "ids": [
                              "GV.PO-01",
                              "GV.PO-02"
                      ],
                      "status": "verified",
                      "note": "Organizational policy 수립·검토"
              },
              "soc_2_tsc": {
                      "ids": [
                              "CC1.1",
                              "CC5.3"
                      ],
                      "status": "verified",
                      "note": "통제환경 + 정책·절차 배포"
              }
      }
    },
    {
      "id": "1.2.1",
      "name": "정보자산 식별",
      "category": "관리체계 수립 및 운영",
      "auto_checkable": "partial",
      "applicable_to": ["all"],
      "signals": [
        { "type": "glob_exists", "access_tier": 0, "pattern": "**/asset-inventory.{yaml,yml,json,md}", "description": "자산 목록 파일 존재", "family": "asset_inventory_present", "required": false },
        { "type": "manual_review", "access_tier": 0, "description": "자산 분류/등급 문서는 외부 증적 필요", "family": "asset_classification_doc", "required": false }
      ],
      "required_capabilities": [
        { "id": "governance", "required_aspects": ["asset_inventory_documented"] }
      ],
      "evidence_hint": "코드 레포 외 자산관리시스템(CMDB) 스크린샷 필요",
      "cross_mappings": {
              "iso_27001_2022": {
                      "ids": [
                              "A.5.9",
                              "A.5.12"
                      ],
                      "status": "verified",
                      "note": "자산 목록 + 정보 분류"
              },
              "nist_csf_2_0": {
                      "ids": [
                              "ID.AM-01",
                              "ID.AM-02",
                              "ID.AM-05"
                      ],
                      "status": "verified",
                      "note": "Hardware/software/data inventory"
              },
              "soc_2_tsc": {
                      "ids": [
                              "CC3.2",
                              "CC6.1"
                      ],
                      "status": "candidate",
                      "note": "위험 식별을 위한 자산 식별 (간접)"
              }
      }
    },
    {
      "id": "1.4.1",
      "name": "법적 요구사항 준수 검토",
      "category": "관리체계 수립 및 운영",
      "auto_checkable": "partial",
      "applicable_to": ["all"],
      "signals": [
        { "type": "glob_exists", "access_tier": 0, "pattern": "**/LICENSE*", "description": "라이선스 파일 존재 (오픈소스 의무 사항 충족)", "family": "license_file_present", "required": false },
        { "type": "glob_exists", "access_tier": 0, "pattern": "**/{COMPLIANCE.md,compliance/**,legal/**}", "description": "법적 컴플라이언스 문서 디렉터리", "family": "legal_compliance_doc", "required": false },
        { "type": "manual_review", "access_tier": 0, "description": "개인정보보호법·정보통신망법 등 법적 요구사항 식별·준수 검토 회의록 (연 1회 이상)", "family": "legal_review_doc", "required": true }
      ],
      "required_capabilities": [
        { "id": "governance", "required_aspects": ["license_compliance"] }
      ],
      "evidence_hint": "법적 요구사항 검토 회의록 + 법규 변경 대응 이력",
      "cross_mappings": {
              "iso_27001_2022": {
                      "ids": [
                              "A.5.31",
                              "A.5.32",
                              "A.5.34",
                              "A.5.36"
                      ],
                      "status": "verified",
                      "note": "법적·계약·지재권·프라이버시·정책 준수"
              },
              "nist_csf_2_0": {
                      "ids": [
                              "GV.OC-03",
                              "GV.OV-03"
                      ],
                      "status": "verified",
                      "note": "법적·규제 요구사항"
              },
              "soc_2_tsc": {
                      "ids": [
                              "CC2.3",
                              "CC9.1"
                      ],
                      "status": "verified",
                      "note": "외부 커뮤니케이션 + 규제 준수"
              }
      }
    },
    {
      "id": "1.4.3",
      "name": "관리체계 개선",
      "category": "관리체계 수립 및 운영",
      "auto_checkable": "no",
      "applicable_to": ["all"],
      "signals": [
        { "type": "manual_review", "access_tier": 0, "description": "관리체계 점검 결과로부터 식별된 개선과제의 이행 계획·완료 이력 (CAPA 트래커, 회의록, 재발방지 대책)", "family": "improvement_doc", "required": true }
      ],
      "required_capabilities": [],
      "evidence_hint": "개선과제 이행 결과 보고서 + 경영진 보고 회의록",
      "cross_mappings": {
              "iso_27001_2022": {
                      "ids": [
                              "A.5.35",
                              "A.5.36"
                      ],
                      "status": "verified",
                      "note": "독립적 검토 + 정책 준수"
              },
              "nist_csf_2_0": {
                      "ids": [
                              "GV.OV-01",
                              "GV.OV-02",
                              "GV.OV-03"
                      ],
                      "status": "verified",
                      "note": "전략 결과 검토·조정"
              },
              "soc_2_tsc": {
                      "ids": [
                              "CC4.1",
                              "CC4.2",
                              "CC5.1"
                      ],
                      "status": "verified",
                      "note": "통제 모니터링·평가·개선"
              }
      }
    },
    {
      "id": "2.5.1",
      "name": "사용자 계정 관리",
      "category": "인증 및 권한관리",
      "auto_checkable": "yes",
      "applicable_to": ["backend", "fullstack", "all"],
      "signals": [
        { "type": "grep_pattern", "access_tier": 0, "pattern": "(user|account)\\s+(creation|provisioning|deactivation)", "paths": ["src/**", "app/**"], "description": "계정 생성/해지 로직 존재", "family": "account_lifecycle_logic", "required": false },
        { "type": "grep_absent", "access_tier": 0, "pattern": "shared[-_ ]?account|guest[-_ ]?login|anonymous[-_ ]?admin", "description": "공유 계정/게스트 로그인 부재", "family": "shared_account", "required": true }
      ],
      "required_capabilities": [
        { "id": "account_lifecycle", "required_aspects": ["provisioning_logic", "shared_account_absent"] }
      ],
      "evidence_hint": "퇴사자 계정 즉시 비활성화 SOP 외부 증적 필요",
      "cross_mappings": {
              "iso_27001_2022": {
                      "ids": [
                              "A.5.16",
                              "A.5.18"
                      ],
                      "status": "verified",
                      "note": "ID 관리 + 접근권한 부여/검토/해제"
              },
              "nist_csf_2_0": {
                      "ids": [
                              "PR.AA-01",
                              "PR.AA-05"
                      ],
                      "status": "verified",
                      "note": "Identity proofing + access management"
              },
              "soc_2_tsc": {
                      "ids": [
                              "CC6.2",
                              "CC6.3"
                      ],
                      "status": "verified",
                      "note": "사용자 등록·변경·해제"
              }
      }
    },
    {
      "id": "2.5.3",
      "name": "사용자 인증",
      "category": "인증 및 권한관리",
      "auto_checkable": "yes",
      "applicable_to": ["backend", "fullstack", "all"],
      "signals": [
        { "type": "grep_pattern", "access_tier": 0, "pattern": "bcrypt|argon2|scrypt|pbkdf2", "paths": ["**/*.ts", "**/*.js", "**/*.py", "**/*.go", "**/*.java", "**/*.rb"], "description": "안전한 비밀번호 해싱 사용", "family": "password_hash_strong", "required": false },
        { "type": "grep_pattern", "access_tier": 0, "pattern": "mfa|otp|totp|two[-_ ]factor|2fa", "description": "MFA/2FA 구현 존재 (애플리케이션 코드)", "family": "mfa_app_code", "required": false },